{
  "schemaVersion": 2,
  "baseAgent": "demo-baseline",
  "baseVariant": "native",
  "headAgent": "demo-guided",
  "headVariant": "ctxhelm_mcp",
  "taskCountDelta": 0,
  "successRateDelta": 1.0,
  "irrelevantReadRateDelta": 0.0,
  "averageRecommendationPrecisionDelta": 1.0,
  "averageRecommendationRecallDelta": 1.0,
  "averageContextPrecisionDelta": 1.0,
  "averageEditedFileRecallDelta": 1.0,
  "validationCoverageRateDelta": 1.0,
  "totalToolCallsDelta": 8,
  "totalTokenEstimateDelta": 64,
  "toolCallsPerSuccessDelta": null,
  "tokenEstimatePerSuccessDelta": null
}